{
  "version": "4.0.0-logical-conclusion-status",
  "generated_at": "2026-07-02T00:00:00Z",
  "policy": "The roadmap acceptance criteria are tracked as evidence-backed status records. Human signoff, public package upload, non-maintainer adoption, and non-Codex/reviewer-supplied hardness evidence must remain pending until real external events are recorded.",
  "summary": {
    "criteria_total": 90,
    "proven": 84,
    "partial": 1,
    "pending_human": 2,
    "pending_package_index": 1,
    "pending_external": 2,
    "pending_total": 6,
    "external_claims_fabricated": false
  },
  "status_definitions": {
    "proven": "Current repository, CI, release, or published-site evidence directly supports the criterion.",
    "partial": "A substantial internal portion is complete, but the criterion includes a future human, package-index, or external-event component.",
    "pending_human": "The criterion requires named human maintainer action that Codex cannot perform.",
    "pending_package_index": "The criterion requires a public package-index upload that a named maintainer must perform.",
    "pending_external": "The criterion requires non-maintainer or non-Codex evidence that is not yet accepted."
  },
  "open_gates": [
    {
      "id": "human-canon-audit",
      "criteria": [
        69,
        70
      ],
      "status": "pending_human",
      "blocker": "Named maintainer review, date, decision, and correction outcome must be recorded before human audit or canonical promotion can be claimed.",
      "evidence": [
        {
          "kind": "path",
          "target": "data/canon_audit.json"
        },
        {
          "kind": "path",
          "target": "data/canon_review_queue.json"
        }
      ]
    },
    {
      "id": "public-package-index",
      "criteria": [
        72,
        88
      ],
      "status": "pending_package_index",
      "blocker": "TestPyPI/PyPI upload must be performed by a named maintainer before public package-index smoke checks can run.",
      "evidence": [
        {
          "kind": "path",
          "target": "examples/adoption/package-index-release-plan.json"
        },
        {
          "kind": "path",
          "target": "examples/adoption/package-check.json"
        },
        {
          "kind": "path",
          "target": "scripts/check_package_index.py"
        },
        {
          "kind": "path",
          "target": "schemas/package-index-smoke.schema.json"
        },
        {
          "kind": "path",
          "target": "examples/adoption/package-index-smoke-template.json"
        }
      ]
    },
    {
      "id": "external-adoption",
      "criteria": [
        74
      ],
      "status": "pending_external",
      "blocker": "At least three non-maintainer reports must be accepted and published with friction/failure fields intact.",
      "evidence": [
        {
          "kind": "path",
          "target": "data/adoption_evidence.json"
        },
        {
          "kind": "path",
          "target": "examples/adoption/adoption-report-template.json"
        }
      ]
    },
    {
      "id": "non-codex-hardness-surface",
      "criteria": [
        79
      ],
      "status": "pending_external",
      "blocker": "At least one additional non-Codex or reviewer-supplied hardness surface must be validated and accepted before cross-surface Bench v4 hardness claims are complete.",
      "evidence": [
        {
          "kind": "path",
          "target": "examples/evaluations/hardness-v4/model-surface-results.json"
        },
        {
          "kind": "path",
          "target": "examples/evaluations/hardness-v4/manual-import-template.json"
        }
      ]
    }
  ],
  "criteria": [
    {
      "id": 1,
      "status": "proven",
      "label": "Public site teaches the theory clearly.",
      "evidence": [
        {
          "kind": "path",
          "target": "index.qmd"
        },
        {
          "kind": "path",
          "target": "chapters/01-operative-language.qmd"
        }
      ]
    },
    {
      "id": 2,
      "status": "proven",
      "label": "Main book is readable and coherent.",
      "evidence": [
        {
          "kind": "path",
          "target": "_quarto.yml"
        },
        {
          "kind": "path",
          "target": "chapters/10-living-practice.qmd"
        }
      ]
    },
    {
      "id": 3,
      "status": "proven",
      "label": "Pocket guide is useful as a daily reference.",
      "evidence": [
        {
          "kind": "path",
          "target": "reference/pocket-field-guide.qmd"
        },
        {
          "kind": "path",
          "target": "data/pocket_runes.json"
        }
      ]
    },
    {
      "id": 4,
      "status": "proven",
      "label": "Stacked-spells system is integrated and validated.",
      "evidence": [
        {
          "kind": "path",
          "target": "data/stacks.json"
        },
        {
          "kind": "path",
          "target": "reference/stack-grammar.qmd"
        }
      ]
    },
    {
      "id": 5,
      "status": "proven",
      "label": "Full lexicon is structured, navigable, and semantically reviewed.",
      "evidence": [
        {
          "kind": "path",
          "target": "data/lexicon.json"
        },
        {
          "kind": "path",
          "target": "reference/lexicon.qmd"
        },
        {
          "kind": "path",
          "target": "data/canon_quality.json"
        }
      ]
    },
    {
      "id": 6,
      "status": "proven",
      "label": "Six initial spells are reusable templates.",
      "evidence": [
        {
          "kind": "path",
          "target": "data/spells.json"
        },
        {
          "kind": "path",
          "target": "spells/index.qmd"
        }
      ]
    },
    {
      "id": 7,
      "status": "proven",
      "label": "Six initial stacks are reusable workflows.",
      "evidence": [
        {
          "kind": "path",
          "target": "data/stacks.json"
        },
        {
          "kind": "path",
          "target": "stacks/index.qmd"
        }
      ]
    },
    {
      "id": 8,
      "status": "proven",
      "label": "Spells and stacks have schemas.",
      "evidence": [
        {
          "kind": "path",
          "target": "schemas/spell.schema.json"
        },
        {
          "kind": "path",
          "target": "schemas/stack.schema.json"
        }
      ]
    },
    {
      "id": 9,
      "status": "proven",
      "label": "Validation, tests, render, and link audit run in CI.",
      "evidence": [
        {
          "kind": "path",
          "target": ".github/workflows/check.yml"
        },
        {
          "kind": "path",
          "target": "scripts/validate_data.py"
        },
        {
          "kind": "path",
          "target": "tests/test_internal_links.py"
        }
      ]
    },
    {
      "id": 10,
      "status": "proven",
      "label": "Quarto publication is automated.",
      "evidence": [
        {
          "kind": "path",
          "target": ".github/workflows/publish.yml"
        }
      ]
    },
    {
      "id": 11,
      "status": "proven",
      "label": "Executable fixtures demonstrate Proof by Difference for field spells.",
      "evidence": [
        {
          "kind": "path",
          "target": "examples/evaluations/execution-results.json"
        },
        {
          "kind": "path",
          "target": "reference/proof-by-difference.qmd"
        }
      ]
    },
    {
      "id": 12,
      "status": "proven",
      "label": "Recorded runs show weak-vs-repaired deltas, scores, variance, and non-wins.",
      "evidence": [
        {
          "kind": "path",
          "target": "examples/evaluations/results.json"
        },
        {
          "kind": "path",
          "target": "reference/evidence-browser.qmd"
        }
      ]
    },
    {
      "id": 13,
      "status": "proven",
      "label": "Project can accept contributions without losing structure.",
      "evidence": [
        {
          "kind": "path",
          "target": "CONTRIBUTING.md"
        },
        {
          "kind": "path",
          "target": ".github/pull_request_template.md"
        }
      ]
    },
    {
      "id": 14,
      "status": "proven",
      "label": "Project has versioned releases.",
      "evidence": [
        {
          "kind": "github_release",
          "target": "https://github.com/corbensorenson/software-grimoire/releases/tag/v2.5.0-roadmap-completion"
        },
        {
          "kind": "path",
          "target": "CHANGELOG.md"
        }
      ]
    },
    {
      "id": 15,
      "status": "proven",
      "label": "User can move from vague request to structured spell to verified result.",
      "evidence": [
        {
          "kind": "path",
          "target": "quick_start.qmd"
        },
        {
          "kind": "path",
          "target": "reference/task-chooser.qmd"
        }
      ]
    },
    {
      "id": 16,
      "status": "proven",
      "label": "Team can move from one-off prompt to reusable stack to versioned practice.",
      "evidence": [
        {
          "kind": "path",
          "target": "adoption/playbook.qmd"
        },
        {
          "kind": "path",
          "target": "stacks/release-gate-stack.qmd"
        }
      ]
    },
    {
      "id": 17,
      "status": "proven",
      "label": "Homepage demonstrates practical value before jargon.",
      "evidence": [
        {
          "kind": "path",
          "target": "index.qmd"
        }
      ]
    },
    {
      "id": 18,
      "status": "proven",
      "label": "Every field spell has copyable and raw template forms.",
      "evidence": [
        {
          "kind": "path",
          "target": "spells/index.qmd"
        },
        {
          "kind": "path",
          "target": "prompts/spells/safe-refactoring.txt"
        }
      ]
    },
    {
      "id": 19,
      "status": "proven",
      "label": "Fifty major canon entries are authored and reviewed.",